{
  "artifacts": [],
  "inputs": {
    "approval_ref": "approval-exp-native-001"
  },
  "limitations": [
    "Experiment executor did not run because no allowlisted command was selected."
  ],
  "node_id": "node-run-experiment",
  "outputs": {
    "runtime": {
      "action": "run_experiment",
      "approval_ref": "approval-exp-native-001",
      "checks": [
        {
          "check": "command_allowlisted",
          "detail": "No experiment command was selected; tried: ['python3 plugins/autosci/bin/autosci_bridge.py run --action run_experiment', 'python3 plugins/autosci/bin/autosci_bridge.py run --action monitor_experiment', '/Users/jamesyuan/.local/share/mise/installs/python/3.14.2/bin/python3 /var/folders/cm/mkjwtys548g3qz7rpq1vbpf00000gn/T/exp-native-debug2-krx7xx64/cmd.py --experiment-id exp-native-001 --marker /var/folders/cm/mkjwtys548g3qz7rpq1vbpf00000gn/T/exp-native-debug2-krx7xx64/marker.txt']",
          "status": "error"
        }
      ],
      "command_run": "blocked:experiment-command-availability",
      "evidence_ids": [
        "experiment-runtime:blocked"
      ],
      "exit_code": 1,
      "result_collected": false,
      "status": "inconclusive"
    }
  },
  "provenance": {
    "implementation_package": "plugins/autosci",
    "operator_id": "autosci-approved-side-effect-executor",
    "timestamp": "2026-06-25T20:48:02Z"
  },
  "schema": "autosci_runtime_evidence.v1",
  "sprint_id": "phase19-skillgen-operator-smoke",
  "status": "inconclusive",
  "task_id": "task-autosci-skillgen-run_experiment"
}
